{
  "schemaVersion": "codex-goal-state@1.0.0",
  "goalId": "unreal-asset-batch-auditor-productization",
  "stateRevision": 15,
  "status": "complete",
  "currentMilestone": "M7",
  "milestones": [
    {
      "id": "M0",
      "title": "Scope and repository baseline",
      "status": "completed",
      "dependsOn": []
    },
    {
      "id": "M1",
      "title": "Read-only Static Mesh audit MVP",
      "status": "completed",
      "dependsOn": ["M0"]
    },
    {
      "id": "M2",
      "title": "Real Unreal host validation",
      "status": "completed",
      "dependsOn": ["M1"]
    },
    {
      "id": "M3",
      "title": "Measured batch performance and production hardening",
      "status": "completed",
      "dependsOn": ["M2"]
    },
    {
      "id": "M4",
      "title": "Audit ledger and production-facing result exploration",
      "status": "completed",
      "dependsOn": ["M3"]
    },
    {
      "id": "M5",
      "title": "Collision, Lightmap UV, naming, and project-structure policies",
      "status": "completed",
      "dependsOn": ["M4"]
    },
    {
      "id": "M6",
      "title": "Large-batch interaction, saved sessions, and team handoff",
      "status": "completed",
      "dependsOn": ["M5"]
    },
    {
      "id": "M7",
      "title": "Release packaging, visual evidence, and portfolio-grade delivery",
      "status": "completed",
      "dependsOn": ["M6"]
    }
  ],
  "nextSlice": null,
  "lastCheckpoint": "artifacts/goal/checkpoint-0015.json",
  "currentBlocker": null,
  "manualTracks": [
    {
      "id": "m4-real-unreal-host",
      "status": "completed",
      "blocking": false,
      "reason": "M4 passed UE 5.8.1 BuildPlugin, independent command-line collection, and independent -RenderOffscreen Slate automation without touching user sessions."
    },
    {
      "id": "m4-visual-evidence",
      "status": "completed",
      "blocking": false,
      "reason": "Eight current-version 1280x688 Slate screenshots cover empty, mixed, pass, issue, filtered evidence, and failure states; hashes are recorded in the M4 host evidence manifest."
    },
    {
      "id": "m5-real-unreal-host",
      "status": "completed",
      "blocking": false,
      "reason": "UE 5.8.1 dev3 collected collision and Lightmap facts for four Engine Static Meshes; all source asset SHA-256 values remained unchanged."
    },
    {
      "id": "m5-visual-evidence",
      "status": "completed",
      "blocking": false,
      "reason": "Eight v0.5 production Slate screenshots cover the expanded ledger plus collision and Lightmap evidence; hashes are recorded in the M5 manifest."
    },
    {
      "id": "m5s2-policy-host-and-visual",
      "status": "completed",
      "blocking": false,
      "reason": "v0.6 added real project-owned naming and directory faults, three fresh UE reports, a clean UE 5.8.1 BuildPlugin, ten production Slate screenshots, and a structured isolated PID lifecycle record."
    },
    {
      "id": "m6s1-history-and-regression",
      "status": "completed",
      "blocking": false,
      "reason": "v0.7 preserves immutable same-Profile sessions, compares new/persistent/resolved/failure changes, packages two real UE reports, passes UE 5.8.1 BuildPlugin, and renders twelve current Slate screenshots in an isolated lifecycle."
    },
    {
      "id": "m6s2-batch-and-handoff",
      "status": "completed",
      "blocking": false,
      "reason": "v0.8 exposes a real tick-driven panel task, between-batch cancellation with valid partial reports, deterministic Chinese HTML/CSV handoff, UE 5.8.1 BuildPlugin, complete/cancelled host evidence, and fifteen current visuals."
    },
    {
      "id": "m7-release-and-clean-install",
      "status": "completed",
      "blocking": false,
      "reason": "v0.8.0 ships as a deterministic 32-file Win64 archive with MIT license, checksums, Chinese installer and docs; fresh install and upgrade each passed the production tab, Python orchestration, real C++ Cube audit and Report output in independent UE 5.8.1 processes; GitHub Release assets are uploaded with matching digest."
    }
  ]
}
